{
    "$schema":  "../../tools/vergil-ver5-dds-recolor.config.schema.json",
    "schemaVersion":  1,
    "themeId":  "weaponmaster-vergil-dark-blue",
    "sourceNpk":  {
                      "path":  "G:/Program Files (x86)/WeGameApps/地下城与勇士：创新世纪/ImagePacks2/sprite_character_swordman_effect_flowmindthree.NPK",
                      "sha256":  "EA066E7FB099FCBC46EDC500BB58BC724707C5FDE65248DFD08F304FBD3BCBD5",
                      "length":  24914
                  },
    "output":  {
                   "componentNpkPath":  "../../npk/full-skill-v1/components/weaponmaster-vergil-dark-blue-flowmindthree-v1.NPK",
                   "buildSummaryPath":  "../../validation/full-skill-v1/components/flowmindthree/build-summary.json"
               },
    "allowedImgPaths":  [
                            "sprite/character/swordman/effect/flowmindthree/effect_dodge.img",
                            "sprite/character/swordman/effect/flowmindthree/line_dodge.img"
                        ],
    "excludedFrameKeys":  [
                          ]
}
