{
  "$schema": "../../tools/vergil-ver5-dds-recolor.config.schema.json",
  "schemaVersion": 1,
  "themeId": "weaponmaster-vergil-dark-blue",
  "sourceNpk": {
    "path": "G:/Program Files (x86)/dnfCopy/地下城与勇士-补丁制作引用源码/ImagePacks2/sprite_character_swordman_effect_jumpattackmulti.NPK",
    "sha256": "12A975EA962C670FB2B65CE0C4F3170DAB8FE8A65213C3A5D2DF12ABC7FFD908",
    "length": 125684
  },
  "output": {
    "componentNpkPath": "../../npk/full-skill-v1/components/weaponmaster-vergil-dark-blue-jumpattackmulti-v1.NPK",
    "buildSummaryPath": "../../validation/full-skill-v1/components/jumpattackmulti/build-summary.json"
  },
  "allowedImgPaths": [
    "sprite/character/swordman/effect/jumpattackmulti/do_jumpchainattack_katana_under.img",
    "sprite/character/swordman/effect/jumpattackmulti/do_jumpchainattack_katana_upper.img",
    "sprite/character/swordman/effect/jumpattackmulti/do_jumpchainattack_ldodge_under.img",
    "sprite/character/swordman/effect/jumpattackmulti/do_jumpchainattack_ldodge_upper.img",
    "sprite/character/swordman/effect/jumpattackmulti/jumpchainattack_club.img",
    "sprite/character/swordman/effect/jumpattackmulti/jumpchainattack_ldodge.img"
  ],
  "excludedFrameKeys": [
    "sprite/character/swordman/effect/jumpattackmulti/do_jumpchainattack_katana_under.img#1",
    "sprite/character/swordman/effect/jumpattackmulti/do_jumpchainattack_katana_upper.img#7",
    "sprite/character/swordman/effect/jumpattackmulti/do_jumpchainattack_katana_upper.img#8",
    "sprite/character/swordman/effect/jumpattackmulti/do_jumpchainattack_katana_upper.img#9"
  ]
}
