{
  "$schema": "./vergil-ver5-dds-recolor.config.schema.json",
  "schemaVersion": 1,
  "themeId": "weaponmaster-vergil-dark-blue",
  "sourceNpk": {
    "path": "G:/Program Files (x86)/WeGameApps/地下城与勇士：创新世纪/ImagePacks2/sprite_character_swordman_effect_momentaryslash.NPK",
    "sha256": "B1B0758EC8D958547E3184F9482E83ED4128C8513609E367B6CF3D287CE6B105",
    "length": 223755
  },
  "output": {
    "componentNpkPath": "../npk/weaponmaster-vergil-dark-blue-ver5-example-v1.NPK",
    "buildSummaryPath": "../validation/ver5-example-v1/build-summary.json"
  },
  "allowedImgPaths": [
    "sprite/character/swordman/effect/momentaryslash/drawingsword_blue_ldodge_upper.img"
  ],
  "excludedFrameKeys": [
    "sprite/character/swordman/effect/momentaryslash/drawingsword_blue_ldodge_upper.img#0"
  ]
}
