{
    "$schema":  "../../tools/vergil-ver5-dds-recolor.config.schema.json",
    "schemaVersion":  1,
    "themeId":  "weaponmaster-vergil-dark-blue",
    "sourceNpk":  {
                      "path":  "G:/Program Files (x86)/WeGameApps/地下城与勇士：创新世纪/ImagePacks2/sprite_character_swordman_effect_flowmindone.NPK",
                      "sha256":  "EEB5E9144B67581F8A936803351EC1D4C890B6FA1237EE359F96EAF49B799D35",
                      "length":  131749
                  },
    "output":  {
                   "componentNpkPath":  "../../npk/full-skill-v1/components/weaponmaster-vergil-dark-blue-flowmindone-v1.NPK",
                   "buildSummaryPath":  "../../validation/full-skill-v1/components/flowmindone/build-summary.json"
               },
    "allowedImgPaths":  [
                            "sprite/character/swordman/effect/flowmindone/dash_dodge.img",
                            "sprite/character/swordman/effect/flowmindone/fallstate_one.img",
                            "sprite/character/swordman/effect/flowmindone/fallstate_one_leap.img",
                            "sprite/character/swordman/effect/flowmindone/short_heavy_add_dodge.img"
                        ],
    "excludedFrameKeys":  [
                          ]
}
