{
  "$schema": "../../tools/vergil-ver5-dds-recolor.config.schema.json",
  "schemaVersion": 1,
  "themeId": "weaponmaster-vergil-dark-blue",
  "sourceNpk": {
    "path": "G:/Program Files (x86)/dnfCopy/地下城与勇士-补丁制作引用源码/ImagePacks2/sprite_character_swordman_effect_handlingsword.NPK",
    "sha256": "38EFE2DA15E49ACB44BB1C2E9FD018099FEFA8A942F1D6F624CA7A19F0DB3A73",
    "length": 5063754
  },
  "output": {
    "componentNpkPath": "../../npk/full-skill-v1/components/weaponmaster-vergil-dark-blue-handlingsword-v1.NPK",
    "buildSummaryPath": "../../validation/full-skill-v1/components/handlingsword/build-summary.json"
  },
  "allowedImgPaths": [
    "sprite/character/swordman/effect/handlingsword/circlea.img",
    "sprite/character/swordman/effect/handlingsword/dusta.img",
    "sprite/character/swordman/effect/handlingsword/dustb.img",
    "sprite/character/swordman/effect/handlingsword/fraga.img",
    "sprite/character/swordman/effect/handlingsword/handlingsword_atk_eff_a.chn.img",
    "sprite/character/swordman/effect/handlingsword/handlingsword_atk_eff_a.img",
    "sprite/character/swordman/effect/handlingsword/handlingsword_atk_eff_a.jpn.img",
    "sprite/character/swordman/effect/handlingsword/handlingsword_atk_eff_a.kor.img",
    "sprite/character/swordman/effect/handlingsword/handlingsword_atk_eff_a.univ.img",
    "sprite/character/swordman/effect/handlingsword/handlingsword_atk_eff_a_new.img",
    "sprite/character/swordman/effect/handlingsword/handlingsword_atk_eff_b.img",
    "sprite/character/swordman/effect/handlingsword/handlingsword_atk_eff_b_new.img",
    "sprite/character/swordman/effect/handlingsword/handlingsword_finish_dodge.chn.img",
    "sprite/character/swordman/effect/handlingsword/handlingsword_finish_dodge.img",
    "sprite/character/swordman/effect/handlingsword/handlingsword_finish_dodge.jpn.img",
    "sprite/character/swordman/effect/handlingsword/handlingsword_finish_dodge.kor.img",
    "sprite/character/swordman/effect/handlingsword/handlingsword_finish_dodge.univ.img",
    "sprite/character/swordman/effect/handlingsword/handlingsword_finish_eff_a.img",
    "sprite/character/swordman/effect/handlingsword/handlingsword_finish_eff_a_new.img",
    "sprite/character/swordman/effect/handlingsword/handlingsword_finish_eff_b.img",
    "sprite/character/swordman/effect/handlingsword/handlingsword_finish_eff_c.chn.img",
    "sprite/character/swordman/effect/handlingsword/handlingsword_finish_eff_c.img",
    "sprite/character/swordman/effect/handlingsword/handlingsword_finish_eff_c.jpn.img",
    "sprite/character/swordman/effect/handlingsword/handlingsword_finish_eff_c.kor.img",
    "sprite/character/swordman/effect/handlingsword/handlingsword_finish_eff_c.univ.img",
    "sprite/character/swordman/effect/handlingsword/handlingsword_finish_eff_d.img",
    "sprite/character/swordman/effect/handlingsword/handlingsword_finish_eff_e.img",
    "sprite/character/swordman/effect/handlingsword/handlingsword_finish_eff_f.img",
    "sprite/character/swordman/effect/handlingsword/handlingsword_finish_eff_g.chn.img",
    "sprite/character/swordman/effect/handlingsword/handlingsword_finish_eff_g.img",
    "sprite/character/swordman/effect/handlingsword/handlingsword_finish_eff_g.jpn.img",
    "sprite/character/swordman/effect/handlingsword/handlingsword_finish_eff_g.kor.img",
    "sprite/character/swordman/effect/handlingsword/handlingsword_finish_eff_g.univ.img",
    "sprite/character/swordman/effect/handlingsword/handlingsword_finish_eff_h.img",
    "sprite/character/swordman/effect/handlingsword/handlingsword_finish_normal.img",
    "sprite/character/swordman/effect/handlingsword/handlingsword_finish_sword_dodge.chn.img",
    "sprite/character/swordman/effect/handlingsword/handlingsword_finish_sword_dodge.img",
    "sprite/character/swordman/effect/handlingsword/handlingsword_finish_sword_dodge.jpn.img",
    "sprite/character/swordman/effect/handlingsword/handlingsword_finish_sword_dodge.kor.img",
    "sprite/character/swordman/effect/handlingsword/handlingsword_finish_sword_dodge.univ.img",
    "sprite/character/swordman/effect/handlingsword/handlingsword_finish_sword_normal.img",
    "sprite/character/swordman/effect/handlingsword/handlingsword_return.img",
    "sprite/character/swordman/effect/handlingsword/handlingsword_shoot_eff.img",
    "sprite/character/swordman/effect/handlingsword/handlingsword_shoot_eff_new.img",
    "sprite/character/swordman/effect/handlingsword/handlingsword_stand_dodge.img",
    "sprite/character/swordman/effect/handlingsword/handlingsword_stand_normal.img",
    "sprite/character/swordman/effect/handlingsword/handlingsword_stand_shoot.chn.img",
    "sprite/character/swordman/effect/handlingsword/handlingsword_stand_shoot.img",
    "sprite/character/swordman/effect/handlingsword/handlingsword_stand_shoot.jpn.img",
    "sprite/character/swordman/effect/handlingsword/handlingsword_stand_shoot.kor.img",
    "sprite/character/swordman/effect/handlingsword/handlingsword_stand_shoot.univ.img",
    "sprite/character/swordman/effect/handlingsword/handlingsword_stand_shoot_new.img",
    "sprite/character/swordman/effect/handlingsword/handlingsword_stand_white.chn.img",
    "sprite/character/swordman/effect/handlingsword/handlingsword_stand_white.img",
    "sprite/character/swordman/effect/handlingsword/handlingsword_stand_white.jpn.img",
    "sprite/character/swordman/effect/handlingsword/handlingsword_stand_white.kor.img",
    "sprite/character/swordman/effect/handlingsword/handlingsword_stand_white.univ.img",
    "sprite/character/swordman/effect/handlingsword/handlingsword_start.img",
    "sprite/character/swordman/effect/handlingsword/handlingsword_start_b.chn.img",
    "sprite/character/swordman/effect/handlingsword/handlingsword_start_b.img",
    "sprite/character/swordman/effect/handlingsword/handlingsword_start_b.jpn.img",
    "sprite/character/swordman/effect/handlingsword/handlingsword_start_b.kor.img",
    "sprite/character/swordman/effect/handlingsword/handlingsword_start_b.univ.img",
    "sprite/character/swordman/effect/handlingsword/lighta.img",
    "sprite/character/swordman/effect/handlingsword/particlesa.img",
    "sprite/character/swordman/effect/handlingsword/particlesb.img",
    "sprite/character/swordman/effect/handlingsword/sparka.img",
    "sprite/character/swordman/effect/handlingsword/sword.img",
    "sprite/character/swordman/effect/handlingsword/traila.img",
    "sprite/character/swordman/effect/handlingsword/trailb.img",
    "sprite/character/swordman/effect/handlingsword/wingstart.img"
  ],
  "excludedFrameKeys": [
    "sprite/character/swordman/effect/handlingsword/handlingsword_finish_eff_d.img#2",
    "sprite/character/swordman/effect/handlingsword/handlingsword_finish_eff_d.img#3",
    "sprite/character/swordman/effect/handlingsword/handlingsword_start.img#0",
    "sprite/character/swordman/effect/handlingsword/handlingsword_start.img#1",
    "sprite/character/swordman/effect/handlingsword/wingstart.img#14",
    "sprite/character/swordman/effect/handlingsword/wingstart.img#15",
    "sprite/character/swordman/effect/handlingsword/wingstart.img#16",
    "sprite/character/swordman/effect/handlingsword/wingstart.img#17",
    "sprite/character/swordman/effect/handlingsword/wingstart.img#18",
    "sprite/character/swordman/effect/handlingsword/wingstart.img#19",
    "sprite/character/swordman/effect/handlingsword/wingstart.img#20",
    "sprite/character/swordman/effect/handlingsword/wingstart.img#21",
    "sprite/character/swordman/effect/handlingsword/wingstart.img#22",
    "sprite/character/swordman/effect/handlingsword/wingstart.img#23",
    "sprite/character/swordman/effect/handlingsword/wingstart.img#24",
    "sprite/character/swordman/effect/handlingsword/wingstart.img#25",
    "sprite/character/swordman/effect/handlingsword/wingstart.img#26",
    "sprite/character/swordman/effect/handlingsword/wingstart.img#27"
  ]
}
