{
  "$schema": "../../tools/vergil-ver5-dds-recolor.config.schema.json",
  "schemaVersion": 1,
  "themeId": "weaponmaster-vergil-dark-blue",
  "sourceNpk": {
    "path": "G:/Program Files (x86)/dnfCopy/地下城与勇士-补丁制作引用源码/ImagePacks2/sprite_character_swordman_effect_spritconversion.NPK",
    "sha256": "E8B2815E5E7167206FC767F7FF9B30391345F9CDCA9B80EE97C763E471D074C3",
    "length": 178518
  },
  "output": {
    "componentNpkPath": "../../npk/full-skill-v1/components/weaponmaster-vergil-dark-blue-spritconversion-v1.NPK",
    "buildSummaryPath": "../../validation/full-skill-v1/components/spritconversion/build-summary.json"
  },
  "allowedImgPaths": [
    "sprite/character/swordman/effect/spritconversion/aura1.img"
  ],
  "excludedFrameKeys": []
}
