{
    "$schema":  "../../tools/vergil-ver5-dds-recolor.config.schema.json",
    "schemaVersion":  1,
    "themeId":  "weaponmaster-vergil-dark-blue",
    "sourceNpk":  {
                      "path":  "G:/Program Files (x86)/WeGameApps/地下城与勇士：创新世纪/ImagePacks2/sprite_character_swordman_effect_stateoflimit.NPK",
                      "sha256":  "97AC34E6FF63032B8C75E2BF63DD19B245FAAACCC9DC852B680ACC61EA891D2B",
                      "length":  3387806
                  },
    "output":  {
                   "componentNpkPath":  "../../npk/full-skill-v1/components/weaponmaster-vergil-dark-blue-stateoflimit-v1.NPK",
                   "buildSummaryPath":  "../../validation/full-skill-v1/components/stateoflimit/build-summary.json"
               },
    "allowedImgPaths":  [
                            "sprite/character/swordman/effect/stateoflimit/dustc.img",
                            "sprite/character/swordman/effect/stateoflimit/dustd.img",
                            "sprite/character/swordman/effect/stateoflimit/state_of_limit_backstep.img",
                            "sprite/character/swordman/effect/stateoflimit/state_of_limit_crash.img",
                            "sprite/character/swordman/effect/stateoflimit/state_of_limit_dragon.img",
                            "sprite/character/swordman/effect/stateoflimit/state_of_limit_dragon_new.img",
                            "sprite/character/swordman/effect/stateoflimit/state_of_limit_draw.img",
                            "sprite/character/swordman/effect/stateoflimit/tornadoastart.img",
                            "sprite/character/swordman/effect/stateoflimit/tornadobloop1.img",
                            "sprite/character/swordman/effect/stateoflimit/tornadobloop2.img",
                            "sprite/character/swordman/effect/stateoflimit/tornadocloop.img",
                            "sprite/character/swordman/effect/stateoflimit/tornadodend1.img",
                            "sprite/character/swordman/effect/stateoflimit/tornadodend2.img"
                        ],
    "excludedFrameKeys":  [
                              "sprite/character/swordman/effect/stateoflimit/tornadocloop.img#1"
                          ]
}
