{
    "$schema":  "../../tools/vergil-ver5-dds-recolor.config.schema.json",
    "schemaVersion":  1,
    "themeId":  "weaponmaster-vergil-dark-blue",
    "sourceNpk":  {
                      "path":  "G:/Program Files (x86)/WeGameApps/地下城与勇士：创新世纪/ImagePacks2/sprite_character_swordman_effect_flowmindpowerup.NPK",
                      "sha256":  "115B5EB3BD38E19B7106DE353DAA291FA7139BF54255D1B3A89068CCE9414A35",
                      "length":  37592
                  },
    "output":  {
                   "componentNpkPath":  "../../npk/full-skill-v1/components/weaponmaster-vergil-dark-blue-flowmindpowerup-v1.NPK",
                   "buildSummaryPath":  "../../validation/full-skill-v1/components/flowmindpowerup/build-summary.json"
               },
    "allowedImgPaths":  [
                            "sprite/character/swordman/effect/flowmindpowerup/charge_dodge.img",
                            "sprite/character/swordman/effect/flowmindpowerup/flash_dodge.img",
                            "sprite/character/swordman/effect/flowmindpowerup/flow_mind_power_up_hit_effect.img"
                        ],
    "excludedFrameKeys":  [
                          ]
}
