{
  "$schema": "../../tools/vergil-ver5-dds-recolor.config.schema.json",
  "schemaVersion": 1,
  "themeId": "weaponmaster-vergil-dark-blue",
  "sourceNpk": {
    "path": "G:/Program Files (x86)/WeGameApps/地下城与勇士：创新世纪/ImagePacks2/sprite_character_swordman_effect_tripleslash.NPK",
    "sha256": "46A9A22E1D24511D1442A007E7232F6D0A6FA5D81BD6E3CD457EC86A0F36DF9A",
    "length": 74667
  },
  "output": {
    "componentNpkPath": "../../npk/full-skill-v1/components/weaponmaster-vergil-dark-blue-tripleslash-v1.NPK",
    "buildSummaryPath": "../../validation/full-skill-v1/components/tripleslash/build-summary.json"
  },
  "allowedImgPaths": [
    "sprite/character/swordman/effect/tripleslash/01.img",
    "sprite/character/swordman/effect/tripleslash/02.img",
    "sprite/character/swordman/effect/tripleslash/03.img",
    "sprite/character/swordman/effect/tripleslash/04.img",
    "sprite/character/swordman/effect/tripleslash/05.img",
    "sprite/character/swordman/effect/tripleslash/move.img"
  ],
  "excludedFrameKeys": []
}
