{
    "$schema":  "../../tools/vergil-ver5-dds-recolor.config.schema.json",
    "schemaVersion":  1,
    "themeId":  "weaponmaster-vergil-dark-blue",
    "sourceNpk":  {
                      "path":  "G:/Program Files (x86)/WeGameApps/地下城与勇士：创新世纪/ImagePacks2/sprite_character_swordman_effect_mysticequip.NPK",
                      "sha256":  "FD5E25AF00C6D2AA0FA3908422C38A3944AACA7BC0DDB0F9A2910023B2A25C7E",
                      "length":  51279
                  },
    "output":  {
                   "componentNpkPath":  "../../npk/full-skill-v1/components/weaponmaster-vergil-dark-blue-mysticequip-v1.NPK",
                   "buildSummaryPath":  "../../validation/full-skill-v1/components/mysticequip/build-summary.json"
               },
    "allowedImgPaths":  [
                            "sprite/character/swordman/effect/mysticequip/mysticequip.img"
                        ],
    "excludedFrameKeys":  [
                          ]
}
