{
  "$schema": "../../tools/vergil-ver5-dds-recolor.config.schema.json",
  "schemaVersion": 1,
  "themeId": "weaponmaster-vergil-dark-blue",
  "sourceNpk": {
    "path": "G:/Program Files (x86)/WeGameApps/地下城与勇士：创新世纪/ImagePacks2/sprite_character_swordman_effect.NPK",
    "sha256": "16847CE0867D2DCD5C1E0E504B0DE6DC59AA31F3737D3C2EBC42DF4C0C17C60B",
    "length": 2645474
  },
  "output": {
    "componentNpkPath": "../../npk/full-skill-v1/components/weaponmaster-vergil-dark-blue-common-autoguard-none-stable-v1.NPK",
    "buildSummaryPath": "../../validation/full-skill-v1/components/common-autoguard-none-stable/build-summary.json"
  },
  "allowedImgPaths": [
    "sprite/character/swordman/effect/autoguard_none.img"
  ],
  "excludedFrameKeys": [
    "sprite/character/swordman/effect/autoguard_none.img#0"
  ]
}
