{
    "$schema":  "../../tools/vergil-ver5-dds-recolor.config.schema.json",
    "schemaVersion":  1,
    "themeId":  "weaponmaster-vergil-dark-blue",
    "sourceNpk":  {
                      "path":  "G:/Program Files (x86)/WeGameApps/地下城与勇士：创新世纪/ImagePacks2/sprite_character_swordman_effect_ultimatecrossslash.NPK",
                      "sha256":  "669B2BE1DC1AEA0D3D3DFE4A098830DD01211292ACF8462F2328C582E280B473",
                      "length":  8708896
                  },
    "output":  {
                   "componentNpkPath":  "../../npk/full-skill-v1/components/weaponmaster-vergil-dark-blue-ultimatecrossslash-v1.NPK",
                   "buildSummaryPath":  "../../validation/full-skill-v1/components/ultimatecrossslash/build-summary.json"
               },
    "allowedImgPaths":  [
                            "sprite/character/swordman/effect/ultimatecrossslash/a01.img",
                            "sprite/character/swordman/effect/ultimatecrossslash/a02.img",
                            "sprite/character/swordman/effect/ultimatecrossslash/attack.img",
                            "sprite/character/swordman/effect/ultimatecrossslash/b01.img",
                            "sprite/character/swordman/effect/ultimatecrossslash/back01.img",
                            "sprite/character/swordman/effect/ultimatecrossslash/back1.img",
                            "sprite/character/swordman/effect/ultimatecrossslash/back2.img",
                            "sprite/character/swordman/effect/ultimatecrossslash/disappeara2.img",
                            "sprite/character/swordman/effect/ultimatecrossslash/disappearb2.img",
                            "sprite/character/swordman/effect/ultimatecrossslash/enddodge01.img",
                            "sprite/character/swordman/effect/ultimatecrossslash/enddodge02.img",
                            "sprite/character/swordman/effect/ultimatecrossslash/endnomal01.img",
                            "sprite/character/swordman/effect/ultimatecrossslash/last01b.img",
                            "sprite/character/swordman/effect/ultimatecrossslash/ligth01.img",
                            "sprite/character/swordman/effect/ultimatecrossslash/moveeffect01.img",
                            "sprite/character/swordman/effect/ultimatecrossslash/smoke01.img",
                            "sprite/character/swordman/effect/ultimatecrossslash/smoke02.img",
                            "sprite/character/swordman/effect/ultimatecrossslash/sword.img"
                        ],
    "excludedFrameKeys":  [
                              "sprite/character/swordman/effect/ultimatecrossslash/b01.img#20",
                              "sprite/character/swordman/effect/ultimatecrossslash/endnomal01.img#18",
                              "sprite/character/swordman/effect/ultimatecrossslash/endnomal01.img#19",
                              "sprite/character/swordman/effect/ultimatecrossslash/last01b.img#13",
                              "sprite/character/swordman/effect/ultimatecrossslash/last01b.img#14",
                              "sprite/character/swordman/effect/ultimatecrossslash/last01b.img#15",
                              "sprite/character/swordman/effect/ultimatecrossslash/last01b.img#16",
                              "sprite/character/swordman/effect/ultimatecrossslash/last01b.img#17",
                              "sprite/character/swordman/effect/ultimatecrossslash/last01b.img#18",
                              "sprite/character/swordman/effect/ultimatecrossslash/last01b.img#19",
                              "sprite/character/swordman/effect/ultimatecrossslash/last01b.img#20",
                              "sprite/character/swordman/effect/ultimatecrossslash/last01b.img#21",
                              "sprite/character/swordman/effect/ultimatecrossslash/last01b.img#22",
                              "sprite/character/swordman/effect/ultimatecrossslash/last01b.img#23",
                              "sprite/character/swordman/effect/ultimatecrossslash/last01b.img#24",
                              "sprite/character/swordman/effect/ultimatecrossslash/last01b.img#25",
                              "sprite/character/swordman/effect/ultimatecrossslash/last01b.img#26",
                              "sprite/character/swordman/effect/ultimatecrossslash/last01b.img#27"
                          ]
}
