{
    "$schema":  "../../tools/vergil-ver5-dds-recolor.config.schema.json",
    "schemaVersion":  1,
    "themeId":  "weaponmaster-vergil-dark-blue",
    "sourceNpk":  {
                      "path":  "G:/Program Files (x86)/WeGameApps/地下城与勇士：创新世纪/ImagePacks2/sprite_character_swordman_effect_hundredsword.NPK",
                      "sha256":  "AF2A21C987CC775FE0D8003A4A02A958113CD5ED9545BBF848778C91C333C72C",
                      "length":  896780
                  },
    "output":  {
                   "componentNpkPath":  "../../npk/full-skill-v1/components/weaponmaster-vergil-dark-blue-hundredsword-v1.NPK",
                   "buildSummaryPath":  "../../validation/full-skill-v1/components/hundredsword/build-summary.json"
               },
    "allowedImgPaths":  [
                            "sprite/character/swordman/effect/hundredsword/(18)sword00.img",
                            "sprite/character/swordman/effect/hundredsword/(18)sword01.img",
                            "sprite/character/swordman/effect/hundredsword/(18)sword02.img",
                            "sprite/character/swordman/effect/hundredsword/(18)sword03.img",
                            "sprite/character/swordman/effect/hundredsword/(18)weapon0000.img",
                            "sprite/character/swordman/effect/hundredsword/(18)weapon0001.img",
                            "sprite/character/swordman/effect/hundredsword/(18)weapon0100.img",
                            "sprite/character/swordman/effect/hundredsword/(18)weapon0101.img",
                            "sprite/character/swordman/effect/hundredsword/(18)weapon0200.img",
                            "sprite/character/swordman/effect/hundredsword/(18)weapon0201.img",
                            "sprite/character/swordman/effect/hundredsword/(18)weapon0300.img",
                            "sprite/character/swordman/effect/hundredsword/(18)weapon0301.img",
                            "sprite/character/swordman/effect/hundredsword/(tn)sword00.img",
                            "sprite/character/swordman/effect/hundredsword/(tn)sword01.img",
                            "sprite/character/swordman/effect/hundredsword/(tn)sword02.img",
                            "sprite/character/swordman/effect/hundredsword/(tn)sword03.img",
                            "sprite/character/swordman/effect/hundredsword/(tn)weapon0000.img",
                            "sprite/character/swordman/effect/hundredsword/(tn)weapon0100.img",
                            "sprite/character/swordman/effect/hundredsword/(tn)weapon0101.img",
                            "sprite/character/swordman/effect/hundredsword/(tn)weapon0200.img",
                            "sprite/character/swordman/effect/hundredsword/(tn)weapon0201.img",
                            "sprite/character/swordman/effect/hundredsword/(tn)weapon0300.img",
                            "sprite/character/swordman/effect/hundredsword/(tn)weapon0301.img",
                            "sprite/character/swordman/effect/hundredsword/cast.img",
                            "sprite/character/swordman/effect/hundredsword/dash.img",
                            "sprite/character/swordman/effect/hundredsword/exp1.img",
                            "sprite/character/swordman/effect/hundredsword/exp2.img",
                            "sprite/character/swordman/effect/hundredsword/finish.img",
                            "sprite/character/swordman/effect/hundredsword/finish_slash.img",
                            "sprite/character/swordman/effect/hundredsword/finish_slash_circle.img",
                            "sprite/character/swordman/effect/hundredsword/floor_circle.img",
                            "sprite/character/swordman/effect/hundredsword/floor_glow.img",
                            "sprite/character/swordman/effect/hundredsword/light_exp.img",
                            "sprite/character/swordman/effect/hundredsword/slash.img",
                            "sprite/character/swordman/effect/hundredsword/sword_back_glow.img",
                            "sprite/character/swordman/effect/hundredsword/sword_light.img",
                            "sprite/character/swordman/effect/hundredsword/sword_light_tail.img",
                            "sprite/character/swordman/effect/hundredsword/sword00.img",
                            "sprite/character/swordman/effect/hundredsword/sword01.img",
                            "sprite/character/swordman/effect/hundredsword/sword02.img",
                            "sprite/character/swordman/effect/hundredsword/sword03.img",
                            "sprite/character/swordman/effect/hundredsword/sword05.img",
                            "sprite/character/swordman/effect/hundredsword/weapon0000.img",
                            "sprite/character/swordman/effect/hundredsword/weapon0001.img",
                            "sprite/character/swordman/effect/hundredsword/weapon0100.img",
                            "sprite/character/swordman/effect/hundredsword/weapon0101.img",
                            "sprite/character/swordman/effect/hundredsword/weapon0200.img",
                            "sprite/character/swordman/effect/hundredsword/weapon0201.img",
                            "sprite/character/swordman/effect/hundredsword/weapon0300.img",
                            "sprite/character/swordman/effect/hundredsword/weapon0301.img",
                            "sprite/character/swordman/effect/hundredsword/weapon0500.img",
                            "sprite/character/swordman/effect/hundredsword/weapon0501.img",
                            "sprite/character/swordman/effect/hundredsword/weapon0503.img"
                        ],
    "excludedFrameKeys":  [
                              "sprite/character/swordman/effect/hundredsword/(18)weapon0000.img#0",
                              "sprite/character/swordman/effect/hundredsword/(18)weapon0000.img#1",
                              "sprite/character/swordman/effect/hundredsword/(18)weapon0001.img#2",
                              "sprite/character/swordman/effect/hundredsword/(18)weapon0100.img#0",
                              "sprite/character/swordman/effect/hundredsword/(18)weapon0100.img#1",
                              "sprite/character/swordman/effect/hundredsword/(18)weapon0101.img#2",
                              "sprite/character/swordman/effect/hundredsword/(18)weapon0200.img#0",
                              "sprite/character/swordman/effect/hundredsword/(18)weapon0200.img#1",
                              "sprite/character/swordman/effect/hundredsword/(18)weapon0201.img#2",
                              "sprite/character/swordman/effect/hundredsword/(18)weapon0300.img#0",
                              "sprite/character/swordman/effect/hundredsword/(18)weapon0300.img#1",
                              "sprite/character/swordman/effect/hundredsword/(18)weapon0301.img#2",
                              "sprite/character/swordman/effect/hundredsword/(tn)weapon0000.img#0",
                              "sprite/character/swordman/effect/hundredsword/(tn)weapon0000.img#1",
                              "sprite/character/swordman/effect/hundredsword/(tn)weapon0100.img#0",
                              "sprite/character/swordman/effect/hundredsword/(tn)weapon0100.img#1",
                              "sprite/character/swordman/effect/hundredsword/(tn)weapon0101.img#2",
                              "sprite/character/swordman/effect/hundredsword/(tn)weapon0200.img#0",
                              "sprite/character/swordman/effect/hundredsword/(tn)weapon0200.img#1",
                              "sprite/character/swordman/effect/hundredsword/(tn)weapon0201.img#2",
                              "sprite/character/swordman/effect/hundredsword/(tn)weapon0300.img#0",
                              "sprite/character/swordman/effect/hundredsword/(tn)weapon0300.img#1",
                              "sprite/character/swordman/effect/hundredsword/(tn)weapon0301.img#2",
                              "sprite/character/swordman/effect/hundredsword/weapon0000.img#0",
                              "sprite/character/swordman/effect/hundredsword/weapon0000.img#1",
                              "sprite/character/swordman/effect/hundredsword/weapon0001.img#2",
                              "sprite/character/swordman/effect/hundredsword/weapon0100.img#0",
                              "sprite/character/swordman/effect/hundredsword/weapon0100.img#1",
                              "sprite/character/swordman/effect/hundredsword/weapon0101.img#2",
                              "sprite/character/swordman/effect/hundredsword/weapon0200.img#0",
                              "sprite/character/swordman/effect/hundredsword/weapon0200.img#1",
                              "sprite/character/swordman/effect/hundredsword/weapon0201.img#2",
                              "sprite/character/swordman/effect/hundredsword/weapon0300.img#0",
                              "sprite/character/swordman/effect/hundredsword/weapon0300.img#1",
                              "sprite/character/swordman/effect/hundredsword/weapon0301.img#2",
                              "sprite/character/swordman/effect/hundredsword/weapon0500.img#2",
                              "sprite/character/swordman/effect/hundredsword/weapon0501.img#2"
                          ]
}
