{
    "$schema":  "../../tools/vergil-ver5-dds-recolor.config.schema.json",
    "schemaVersion":  1,
    "themeId":  "weaponmaster-vergil-dark-blue",
    "sourceNpk":  {
                      "path":  "G:/Program Files (x86)/WeGameApps/地下城与勇士：创新世纪/ImagePacks2/sprite_character_swordman_effect_invisibleswordcut.NPK",
                      "sha256":  "9127A930BAC2570A3838C771D663A0AC8BFC4815774AB8163C97F27D138D33C2",
                      "length":  4706614
                  },
    "output":  {
                   "componentNpkPath":  "../../npk/full-skill-v1/components/weaponmaster-vergil-dark-blue-invisibleswordcut-v1.NPK",
                   "buildSummaryPath":  "../../validation/full-skill-v1/components/invisibleswordcut/build-summary.json"
               },
    "allowedImgPaths":  [
                            "sprite/character/swordman/effect/invisibleswordcut/dusta.img",
                            "sprite/character/swordman/effect/invisibleswordcut/dustb.img",
                            "sprite/character/swordman/effect/invisibleswordcut/flarea.img",
                            "sprite/character/swordman/effect/invisibleswordcut/flareb.img",
                            "sprite/character/swordman/effect/invisibleswordcut/flarec.img",
                            "sprite/character/swordman/effect/invisibleswordcut/hiteffecta.img",
                            "sprite/character/swordman/effect/invisibleswordcut/hiteffectb.img",
                            "sprite/character/swordman/effect/invisibleswordcut/hiteffectc.img",
                            "sprite/character/swordman/effect/invisibleswordcut/shocka.img",
                            "sprite/character/swordman/effect/invisibleswordcut/shockb.img",
                            "sprite/character/swordman/effect/invisibleswordcut/slasha.img",
                            "sprite/character/swordman/effect/invisibleswordcut/slashb.img",
                            "sprite/character/swordman/effect/invisibleswordcut/slashc.img",
                            "sprite/character/swordman/effect/invisibleswordcut/slashd.img",
                            "sprite/character/swordman/effect/invisibleswordcut/slashe.img",
                            "sprite/character/swordman/effect/invisibleswordcut/slashf.img",
                            "sprite/character/swordman/effect/invisibleswordcut/slashg.img",
                            "sprite/character/swordman/effect/invisibleswordcut/slashh.img",
                            "sprite/character/swordman/effect/invisibleswordcut/slashi.img",
                            "sprite/character/swordman/effect/invisibleswordcut/slashj.img",
                            "sprite/character/swordman/effect/invisibleswordcut/slashk.img",
                            "sprite/character/swordman/effect/invisibleswordcut/slashl.img",
                            "sprite/character/swordman/effect/invisibleswordcut/sparka.img",
                            "sprite/character/swordman/effect/invisibleswordcut/sparkb.img",
                            "sprite/character/swordman/effect/invisibleswordcut/sparkc.img",
                            "sprite/character/swordman/effect/invisibleswordcut/sparkd.img",
                            "sprite/character/swordman/effect/invisibleswordcut/sparke.img",
                            "sprite/character/swordman/effect/invisibleswordcut/sparkf.img"
                        ],
    "excludedFrameKeys":  [
                              "sprite/character/swordman/effect/invisibleswordcut/dustb.img#19",
                              "sprite/character/swordman/effect/invisibleswordcut/slashd.img#33",
                              "sprite/character/swordman/effect/invisibleswordcut/slashj.img#21",
                              "sprite/character/swordman/effect/invisibleswordcut/sparka.img#18",
                              "sprite/character/swordman/effect/invisibleswordcut/sparka.img#19",
                              "sprite/character/swordman/effect/invisibleswordcut/sparkf.img#13",
                              "sprite/character/swordman/effect/invisibleswordcut/sparkf.img#18",
                              "sprite/character/swordman/effect/invisibleswordcut/sparkf.img#19",
                              "sprite/character/swordman/effect/invisibleswordcut/sparkf.img#20"
                          ]
}
